{
  "format": "rncs.reality-transition-envelope.v0.1",
  "contract_version": "0.1.0",
  "transition_id": "transition:rncs-demo-001",
  "phase": "authorized",
  "base_generation": {
    "reality_id": "world:rncs-demo",
    "generation": 0,
    "generation_root": "6b2ffb2853ca8f15a40468e0848120d27e4be4a36010ac55b4a65595045dfe16"
  },
  "subject": {
    "subject_id": "subject:杜衡界",
    "kind": "human",
    "roles": [],
    "responsibility_boundary": "declared-operation"
  },
  "intent": {
    "intent_id": "intent:建立RNCS项目",
    "source": "demo",
    "goals": [
      "建立现实原生计算项目对象"
    ],
    "constraints": [],
    "intent_root": "81d39be89bdcf5d52b1259461d6f36f7c657e7cd2ed589540a14694d729037f8"
  },
  "capability_plan": {
    "plan_id": "plan:rfe-core",
    "capabilities": [
      "rfe.identity.create",
      "rfe.fact.set",
      "rfe.relation.add"
    ],
    "host_bindings": [],
    "required_scopes": [],
    "plan_root": "49e85a5c50c6361e714c10a291fc74f2b53a05f8b70d2078b594bd14a8d3e93b"
  },
  "inputs": [],
  "provisional_delta": {
    "operations": [
      {
        "op": "createIdentity",
        "identity": {
          "id": "subject:杜衡界",
          "kind": "subject",
          "metadata": {
            "displayName": "杜衡界"
          }
        }
      },
      {
        "op": "createIdentity",
        "identity": {
          "id": "project:rncs",
          "kind": "project",
          "metadata": {
            "title": "现实原生计算栈"
          }
        }
      },
      {
        "op": "setFact",
        "fact": {
          "subject": "project:rncs",
          "predicate": "status",
          "value": "active"
        }
      },
      {
        "op": "setFact",
        "fact": {
          "subject": "project:rncs",
          "predicate": "version",
          "value": "0.1"
        }
      },
      {
        "op": "addRelation",
        "relation": {
          "type": "founded_by",
          "from": "project:rncs",
          "to": "subject:杜衡界"
        }
      }
    ],
    "provisional": true,
    "delta_root": "50048ff5e71a0654c9d9e5d2eb2bed9dc3dcf63218e3a34037c4e6aebfcd6d5e"
  },
  "causal_basis": {
    "events": [],
    "rules": [],
    "simulation_refs": [],
    "causal_root": "19e6318102510bc5757becff7f9d109740c11087915b6da15a000a2d4ff4cbf0"
  },
  "authority": {
    "status": "approved",
    "resolver": "authority:founder",
    "proposal_root": "be23e847df34ad0822a46959133a7a5083f8d3a25e718060c79e279e01f43156",
    "claims": [],
    "constraints": [],
    "reason": "",
    "decision_root": "13c2dad800c4df5768d9809f41f73fb4590eb8a49ee02939cb7f9a2f8449a4fc"
  },
  "evidence": {
    "nodes": [],
    "edges": [],
    "evidence_root": "57501e5c6808b3e14852a4ea21dc7873abf9409032a06f9b740c973e83f62cf7"
  },
  "commit": {
    "status": "not_committed"
  },
  "projections": [],
  "host_state_refs": [],
  "extensions": {},
  "proposal_root": "be23e847df34ad0822a46959133a7a5083f8d3a25e718060c79e279e01f43156",
  "envelope_root": "1a292e5e9176a9a7012fb20d9342a81b6d960f8fb9bb475cb4a52575329bb513"
}
